{
  "resolvedId": "D:/hub2023A/itwinjs-core/common/temp/node_modules/.pnpm/axios@0.21.4/node_modules/axios/package.json",
  "transforms": [
    {
      "name": "vite:load-fallback",
      "result": "{\n  \"name\": \"axios\",\n  \"version\": \"0.21.4\",\n  \"description\": \"Promise based HTTP client for the browser and node.js\",\n  \"main\": \"index.js\",\n  \"scripts\": {\n    \"test\": \"grunt test\",\n    \"start\": \"node ./sandbox/server.js\",\n    \"build\": \"NODE_ENV=production grunt build\",\n    \"preversion\": \"npm test\",\n    \"version\": \"npm run build && grunt version && git add -A dist && git add CHANGELOG.md bower.json package.json\",\n    \"postversion\": \"git push && git push --tags\",\n    \"examples\": \"node ./examples/server.js\",\n    \"coveralls\": \"cat coverage/lcov.info | ./node_modules/coveralls/bin/coveralls.js\",\n    \"fix\": \"eslint --fix lib/**/*.js\"\n  },\n  \"repository\": {\n    \"type\": \"git\",\n    \"url\": \"https://github.com/axios/axios.git\"\n  },\n  \"keywords\": [\n    \"xhr\",\n    \"http\",\n    \"ajax\",\n    \"promise\",\n    \"node\"\n  ],\n  \"author\": \"Matt Zabriskie\",\n  \"license\": \"MIT\",\n  \"bugs\": {\n    \"url\": \"https://github.com/axios/axios/issues\"\n  },\n  \"homepage\": \"https://axios-http.com\",\n  \"devDependencies\": {\n    \"coveralls\": \"^3.0.0\",\n    \"es6-promise\": \"^4.2.4\",\n    \"grunt\": \"^1.3.0\",\n    \"grunt-banner\": \"^0.6.0\",\n    \"grunt-cli\": \"^1.2.0\",\n    \"grunt-contrib-clean\": \"^1.1.0\",\n    \"grunt-contrib-watch\": \"^1.0.0\",\n    \"grunt-eslint\": \"^23.0.0\",\n    \"grunt-karma\": \"^4.0.0\",\n    \"grunt-mocha-test\": \"^0.13.3\",\n    \"grunt-ts\": \"^6.0.0-beta.19\",\n    \"grunt-webpack\": \"^4.0.2\",\n    \"istanbul-instrumenter-loader\": \"^1.0.0\",\n    \"jasmine-core\": \"^2.4.1\",\n    \"karma\": \"^6.3.2\",\n    \"karma-chrome-launcher\": \"^3.1.0\",\n    \"karma-firefox-launcher\": \"^2.1.0\",\n    \"karma-jasmine\": \"^1.1.1\",\n    \"karma-jasmine-ajax\": \"^0.1.13\",\n    \"karma-safari-launcher\": \"^1.0.0\",\n    \"karma-sauce-launcher\": \"^4.3.6\",\n    \"karma-sinon\": \"^1.0.5\",\n    \"karma-sourcemap-loader\": \"^0.3.8\",\n    \"karma-webpack\": \"^4.0.2\",\n    \"load-grunt-tasks\": \"^3.5.2\",\n    \"minimist\": \"^1.2.0\",\n    \"mocha\": \"^8.2.1\",\n    \"sinon\": \"^4.5.0\",\n    \"terser-webpack-plugin\": \"^4.2.3\",\n    \"typescript\": \"^4.0.5\",\n    \"url-search-params\": \"^0.10.0\",\n    \"webpack\": \"^4.44.2\",\n    \"webpack-dev-server\": \"^3.11.0\"\n  },\n  \"browser\": {\n    \"./lib/adapters/http.js\": \"./lib/adapters/xhr.js\"\n  },\n  \"jsdelivr\": \"dist/axios.min.js\",\n  \"unpkg\": \"dist/axios.min.js\",\n  \"typings\": \"./index.d.ts\",\n  \"dependencies\": {\n    \"follow-redirects\": \"^1.14.0\"\n  },\n  \"bundlesize\": [\n    {\n      \"path\": \"./dist/axios.min.js\",\n      \"threshold\": \"5kB\"\n    }\n  ]\n}\n",
      "start": 1693508125703,
      "end": 1693508125747,
      "sourcemaps": null
    },
    {
      "name": "vite:json",
      "result": "export const name = \"axios\";\nexport const version = \"0.21.4\";\nexport const description = \"Promise based HTTP client for the browser and node.js\";\nexport const main = \"index.js\";\nexport const scripts = {\n\ttest: \"grunt test\",\n\tstart: \"node ./sandbox/server.js\",\n\tbuild: \"NODE_ENV=production grunt build\",\n\tpreversion: \"npm test\",\n\tversion: \"npm run build && grunt version && git add -A dist && git add CHANGELOG.md bower.json package.json\",\n\tpostversion: \"git push && git push --tags\",\n\texamples: \"node ./examples/server.js\",\n\tcoveralls: \"cat coverage/lcov.info | ./node_modules/coveralls/bin/coveralls.js\",\n\tfix: \"eslint --fix lib/**/*.js\"\n};\nexport const repository = {\n\ttype: \"git\",\n\turl: \"https://github.com/axios/axios.git\"\n};\nexport const keywords = [\n\t\"xhr\",\n\t\"http\",\n\t\"ajax\",\n\t\"promise\",\n\t\"node\"\n];\nexport const author = \"Matt Zabriskie\";\nexport const license = \"MIT\";\nexport const bugs = {\n\turl: \"https://github.com/axios/axios/issues\"\n};\nexport const homepage = \"https://axios-http.com\";\nexport const devDependencies = {\n\tcoveralls: \"^3.0.0\",\n\t\"es6-promise\": \"^4.2.4\",\n\tgrunt: \"^1.3.0\",\n\t\"grunt-banner\": \"^0.6.0\",\n\t\"grunt-cli\": \"^1.2.0\",\n\t\"grunt-contrib-clean\": \"^1.1.0\",\n\t\"grunt-contrib-watch\": \"^1.0.0\",\n\t\"grunt-eslint\": \"^23.0.0\",\n\t\"grunt-karma\": \"^4.0.0\",\n\t\"grunt-mocha-test\": \"^0.13.3\",\n\t\"grunt-ts\": \"^6.0.0-beta.19\",\n\t\"grunt-webpack\": \"^4.0.2\",\n\t\"istanbul-instrumenter-loader\": \"^1.0.0\",\n\t\"jasmine-core\": \"^2.4.1\",\n\tkarma: \"^6.3.2\",\n\t\"karma-chrome-launcher\": \"^3.1.0\",\n\t\"karma-firefox-launcher\": \"^2.1.0\",\n\t\"karma-jasmine\": \"^1.1.1\",\n\t\"karma-jasmine-ajax\": \"^0.1.13\",\n\t\"karma-safari-launcher\": \"^1.0.0\",\n\t\"karma-sauce-launcher\": \"^4.3.6\",\n\t\"karma-sinon\": \"^1.0.5\",\n\t\"karma-sourcemap-loader\": \"^0.3.8\",\n\t\"karma-webpack\": \"^4.0.2\",\n\t\"load-grunt-tasks\": \"^3.5.2\",\n\tminimist: \"^1.2.0\",\n\tmocha: \"^8.2.1\",\n\tsinon: \"^4.5.0\",\n\t\"terser-webpack-plugin\": \"^4.2.3\",\n\ttypescript: \"^4.0.5\",\n\t\"url-search-params\": \"^0.10.0\",\n\twebpack: \"^4.44.2\",\n\t\"webpack-dev-server\": \"^3.11.0\"\n};\nexport const browser = {\n\t\"./lib/adapters/http.js\": \"./lib/adapters/xhr.js\"\n};\nexport const jsdelivr = \"dist/axios.min.js\";\nexport const unpkg = \"dist/axios.min.js\";\nexport const typings = \"./index.d.ts\";\nexport const dependencies = {\n\t\"follow-redirects\": \"^1.14.0\"\n};\nexport const bundlesize = [\n\t{\n\t\tpath: \"./dist/axios.min.js\",\n\t\tthreshold: \"5kB\"\n\t}\n];\nexport default {\n\tname: name,\n\tversion: version,\n\tdescription: description,\n\tmain: main,\n\tscripts: scripts,\n\trepository: repository,\n\tkeywords: keywords,\n\tauthor: author,\n\tlicense: license,\n\tbugs: bugs,\n\thomepage: homepage,\n\tdevDependencies: devDependencies,\n\tbrowser: browser,\n\tjsdelivr: jsdelivr,\n\tunpkg: unpkg,\n\ttypings: typings,\n\tdependencies: dependencies,\n\tbundlesize: bundlesize\n};\n",
      "start": 1693508125747,
      "end": 1693508125747,
      "order": "normal",
      "sourcemaps": {
        "mappings": ""
      }
    }
  ]
}
